{
  "schema_version": "1.0.0",
  "evidence_id": "engineering-optimization-current",
  "scope": "profile",
  "profile": "engineering_optimization",
  "foundation_documents": [
    "vision",
    "architecture",
    "roadmap"
  ],
  "contracts": [],
  "runtime_verifications": [],
  "execution_cycles": [],
  "qualification_cases": [],
  "benchmark": {
    "protocol_registered": false,
    "blind_cases": [],
    "average_score": 0
  },
  "simulations": [],
  "independent_reviews": [],
  "formal_national_award": false
}
